{
  "meta": {
    "version": 1,
    "last_updated": "2026-04-12",
    "title": "Business Workflow — Store Onboarding & Data Scoping",
    "owner": "vibe-ba"
  },
  "quick_facts": {
    "module": "store",
    "entities_involved": ["Store", "User"],
    "external_systems": ["Redis (flush on store deactivation)"]
  },
  "content": {
    "tldr": "Covers store creation, staff assignment, and deactivation. Also documents the mandatory storeId data scoping contract for all downstream modules.",
    "workflows": [
      {
        "id": "WF-STORE-01",
        "title": "New Store Onboarding",
        "trigger": "New retail location joins the system",
        "steps": [
          "1. Admin calls POST /api/v1/stores with name, taxCode, address",
          "2. System validates taxCode format (/^\\d{10}(-\\d{3})?$/)",
          "3. System checks taxCode uniqueness",
          "4. System creates Store record, isActive=true",
          "5. System returns store object",
          "6. Admin creates staff accounts — POST /api/v1/users with storeId from step 4",
          "7. Admin communicates credentials to staff (out-of-band)"
        ],
        "success_outcome": "Store is active and staff can log in",
        "failure_paths": [
          "Invalid taxCode format → 400",
          "Duplicate taxCode → 409 — contact the MST-registered business"
        ]
      },
      {
        "id": "WF-STORE-02",
        "title": "Store Data Scoping (All Modules)",
        "trigger": "Any authenticated API call that touches business entities",
        "steps": [
          "1. JwtAuthGuard validates and decodes JWT",
          "2. request.user.storeId is set from JWT payload",
          "3. Service layer uses request.user.storeId as WHERE filter on all DB queries",
          "4. storeId from request body or URL params is IGNORED — JWT value is authoritative",
          "5. Any query returning data from a different storeId is a critical bug"
        ],
        "success_outcome": "Every response contains only data owned by the caller's store",
        "failure_paths": [
          "JWT storeId references deactivated store → 401 (checked in JwtStrategy.validate)",
          "DB record has a different storeId than JWT → should never happen if service layer is correct — treat as critical bug"
        ],
        "note": "This workflow is a CROSS-CUTTING CONCERN. Every module's service implementation must follow this pattern. It is NOT the controller's job to enforce this."
      },
      {
        "id": "WF-STORE-03",
        "title": "Store Deactivation (Store Closure)",
        "trigger": "A retail location permanently closes or is suspended",
        "steps": [
          "1. Admin calls PATCH /api/v1/stores/:id/deactivate",
          "2. System sets store.isActive=false",
          "3. System flushes all Redis refresh tokens for users in that store (SCAN + DELETE by pattern refresh:{userId} for all users where storeId matches)",
          "4. System returns 200",
          "5. All users of that store: next login attempt → 401 'Store is deactivated'",
          "6. Existing valid access tokens expire naturally within 15 min (accepted risk)"
        ],
        "success_outcome": "Store and all its user sessions are fully terminated within 15 minutes",
        "failure_paths": [
          "storeId not found → 404",
          "Caller not admin → 403"
        ]
      }
    ],
    "data_scoping_contract": {
      "title": "StoreId Scoping Contract",
      "mandatory_for_all_modules": true,
      "rule": "Every service method that reads or writes a business entity (Product, Order, Invoice) MUST include { storeId: request.user.storeId } in its WHERE clause. No exceptions.",
      "enforcement": "Code review gate. vibe-code-review must reject any service method that queries without storeId filter.",
      "example": {
        "correct": "this.productRepo.find({ where: { storeId: user.storeId } })",
        "incorrect_do_not_do": "this.productRepo.find({})"
      }
    }
  },
  "audit": [
    {
      "version": 1,
      "timestamp": "2026-04-12T00:00:00Z",
      "author": "vibe-ba",
      "action": "created",
      "note": "Store onboarding and data scoping workflows created at BA analysis session"
    }
  ]
}
