{
  "meta": {
    "version": 1,
    "last_updated": "2026-04-12",
    "title": "Business Workflow — Authentication & Session Lifecycle",
    "owner": "vibe-ba"
  },
  "quick_facts": {
    "module": "auth",
    "entities_involved": ["User"],
    "external_systems": ["Redis (session store)"]
  },
  "content": {
    "tldr": "Covers the full lifecycle of a staff session: account creation → login → token refresh → logout → deactivation.",
    "workflows": [
      {
        "id": "WF-AUTH-01",
        "title": "New Staff Account Creation",
        "trigger": "Admin receives a new employee",
        "steps": [
          "1. Admin calls POST /api/v1/users with email, password, role, storeId",
          "2. System validates: email uniqueness, role enum, storeId active, password length",
          "3. System hashes password (bcrypt, cost 12)",
          "4. System creates User record, isActive=true",
          "5. System returns sanitised user (no passwordHash)",
          "6. Admin communicates credentials to employee (out-of-band — email, WhatsApp, etc.)"
        ],
        "success_outcome": "Employee can now log in",
        "failure_paths": [
          "Duplicate email → 409 — admin must use a different email",
          "Inactive storeId → 400 — admin must reactivate store first"
        ]
      },
      {
        "id": "WF-AUTH-02",
        "title": "Staff Login (Session Start)",
        "trigger": "Staff member opens the app / POS terminal at start of shift",
        "steps": [
          "1. Staff enters email + password",
          "2. Client calls POST /api/v1/auth/login",
          "3. System looks up user by lowercase email",
          "4. System checks isActive=true for user AND store",
          "5. System compares bcrypt hash",
          "6. System creates accessToken (JWT, 15 min) with payload { sub, email, role, storeId }",
          "7. System creates refreshToken (random UUID), stores in Redis key refresh:{userId} with TTL 604800s",
          "8. System returns { accessToken, refreshToken, user }",
          "9. Client stores both tokens securely (memory for accessToken, httpOnly cookie or secure storage for refreshToken)"
        ],
        "success_outcome": "Staff is authenticated and can call protected endpoints",
        "failure_paths": [
          "Wrong password or unknown email → 401 'Invalid credentials'",
          "isActive=false (user) → 401 'Account is deactivated'",
          "isActive=false (store) → 401 'Store is deactivated'",
          "Rate limit exceeded → 429"
        ]
      },
      {
        "id": "WF-AUTH-03",
        "title": "Silent Token Refresh",
        "trigger": "Client detects accessToken is expired (exp check before API call, or 401 response)",
        "steps": [
          "1. Client calls POST /api/v1/auth/refresh with refreshToken",
          "2. System looks up Redis key refresh:{userId} decoded from token",
          "3. System verifies token value matches stored value in Redis",
          "4. System checks user is still active",
          "5. System deletes old refreshToken from Redis",
          "6. System issues new accessToken + new refreshToken",
          "7. System stores new refreshToken in Redis with fresh TTL",
          "8. Client replaces both stored tokens"
        ],
        "success_outcome": "Staff session continues seamlessly",
        "failure_paths": [
          "Token not in Redis (expired or rotated) → 401 — client must redirect to login",
          "User deactivated since last refresh → 401 — client clears tokens, redirects to login"
        ]
      },
      {
        "id": "WF-AUTH-04",
        "title": "Logout (Session End)",
        "trigger": "Staff clicks logout, closes shift, or session is manually terminated",
        "steps": [
          "1. Client calls POST /api/v1/auth/logout with valid accessToken in Authorization header",
          "2. System extracts userId from JWT",
          "3. System deletes Redis key refresh:{userId}",
          "4. System returns 200",
          "5. Client discards both tokens from local storage"
        ],
        "success_outcome": "Session is fully invalidated server-side",
        "failure_paths": [
          "Redis key already gone (already logged out) → 200 (idempotent, no error shown to user)"
        ]
      },
      {
        "id": "WF-AUTH-05",
        "title": "Staff Account Deactivation",
        "trigger": "Employee leaves the business or is suspended",
        "steps": [
          "1. Admin calls PATCH /api/v1/users/:id/deactivate",
          "2. System sets user.isActive=false",
          "3. System deletes Redis key refresh:{userId} (immediate revocation)",
          "4. System returns 200",
          "5. Employee's current accessToken remains valid up to 15-min TTL — accepted risk"
        ],
        "success_outcome": "Employee cannot start a new session; current session expires within 15 min",
        "failure_paths": [
          "userId not found → 404",
          "Caller is not admin → 403"
        ]
      }
    ]
  },
  "audit": [
    {
      "version": 1,
      "timestamp": "2026-04-12T00:00:00Z",
      "author": "vibe-ba",
      "action": "created",
      "note": "Auth session lifecycle workflows created at BA analysis session"
    }
  ]
}
